{
  "schema_version": "0.1",
  "crystallization_id": "retencion_afectiva",
  "name": "Retención Afectiva",
  "provenance": [
    {
      "source_id": "METODO-ALQUIMICO-BASE-0.1",
      "title": "Método Alquímico Base",
      "version": "0.1",
      "locator": "cristalizaciones.retencion_afectiva",
      "uri": null,
      "layer": "source_symbolic",
      "notes": "La fuente define descripción, patrón numérico, pesos dimensionales, órganos e intervención."
    }
  ],
  "source_model": {
    "description": "Emoción guardada que se vuelve patrón de contención corporal.",
    "numeric_pattern": "2-4-8",
    "dimension_weights": {
      "inframundo": 25,
      "activacion": 10,
      "apertura": -5
    },
    "organs": [
      "pecho",
      "diafragma",
      "estomago"
    ],
    "interventions": [
      "coherencia_del_pecho",
      "432hz",
      "528hz",
      "permiso_de_recibir",
      "cierre_con_136hz"
    ],
    "status": "source_symbolic"
  },
  "experimental_response_construct": {
    "name": "response_crystallization",
    "definition": "Persistence and path-dependence of an observed response after controlled perturbation.",
    "metrics": [
      {
        "id": "persistence_auc",
        "definition": "Persistencia de la desviación respecto del baseline durante recuperación.",
        "calculation": "Integral discreta de |outcome(t)-baseline| a través de los puntos de recuperación, dividida por la duración observada.",
        "precondition": "Mismo outcome medido en baseline y al menos dos puntos de recuperación.",
        "interpretation": "Mayor valor = la respuesta observada tarda más o se mantiene más alejada del baseline."
      },
      {
        "id": "recovery_time_s",
        "definition": "Tiempo hasta volver a una tolerancia predefinida del baseline.",
        "calculation": "Primer tiempo de recuperación donde |outcome-baseline| <= recovery_tolerance y permanece dentro si existe un punto posterior.",
        "precondition": "Tolerancia declarada antes de analizar y al menos un punto de recuperación.",
        "interpretation": "Mayor tiempo = recuperación más lenta en esta serie."
      },
      {
        "id": "hysteresis_delta",
        "definition": "Diferencia de respuesta al mismo nivel de estímulo según la trayectoria previa.",
        "calculation": "outcome(level, descending) - outcome(level, ascending).",
        "precondition": "El mismo nivel de estímulo debe aparecer en una rama ascendente y descendente.",
        "interpretation": "Valor distinto de cero = dependencia de trayectoria en esta sesión."
      },
      {
        "id": "void_response_slope",
        "definition": "Sensibilidad de la respuesta al gradiente de Vacío en la rama ascendente.",
        "calculation": "Pendiente OLS de outcome frente a silence_ratio para niveles ascendentes preespecificados.",
        "precondition": "Al menos tres niveles de Vacío con el mismo outcome y controles constantes.",
        "interpretation": "Signo y magnitud caracterizan dirección/sensibilidad; no prueban cristalización simbólica."
      }
    ],
    "status": "experimental_operationalization"
  },
  "equivalence_forbidden": "A high response_crystallization metric does not prove the source symbolic crystallization profile."
}